{"Schema":"rackcad-delegation/v1","TaskId":"RD11-AUTOLOADER-TABLE","RunId":"R20261029T004516Z-bf20","Initiative":"I-65","Unit":"I-65","Gate":"R-D11","Attempt":7,"AuthorityRevision":"91f82d6d83731f48d445c7ad007a814b65c6caa6","MainSha":"bb0d5522e8411f66a51fdfb3f1f0d0514b737453","BaseSha":"91f82d6d83731f48d445c7ad007a814b65c6caa6","ExpectedBranch":"architecture/interop-analisis-estructural","ExpectedWorktree":"C:/Users/<usuario>/.codex/worktrees/architecture-interop-analisis-estructural","Owner":{"Kind":"subagent","Id":"subagent:R20261029T004516Z-bf20"},"TaskClass":"Implementación de pruebas","Dimensions":{"Ambiguity":"Low","ArchitecturalSensitivity":"Medium","Breadth":"High","ToolUse":"High","FailureCost":"High","MechanicalRepetition":"Medium","Horizon":"Medium"},"Executor":{"Provider":"Anthropic","Transport":"subagente de la sesion de escritorio","Role":"Worker","Cell":"anthropic/subagent/claude-sonnet-5-5"},"Model":"claude-sonnet-5-5","Effort":{"Semantic":"Deep","Provider":"high"},"PromptProfile":"ROUTINE_IMPLEMENTATION","RoutingReason":"28 de octubre de 2026. Los comandos solicitados dieron rama architecture/interop-analisis-estructural, HEAD 91f82d6d83731f48d445c7ad007a814b65c6caa6, origin/main bb0d5522e8411f66a51fdfb3f1f0d0514b737453 y log 91f82d6d, 95aae3f1, 77774aef; MainSha coincide con origin/main, por lo que no se activa S-13. El contrato de revisión 91f82d6d fija el alcance y la cadena RED/GREEN. La tarea se clasifica como implementación de pruebas: sus cambios verificables principales son el harness y pruebas junto a un target MSBuild, un verificador PowerShell y documentación. Sensibilidad arquitectónica media, coste de fallo alto por la cadena única y ausencia de rework, amplitud alta por los archivos y las fases coordinadas, herramientas altas, ambigüedad baja por el contrato preciso, repetición mecánica media y horizonte medio por caber en una invocación. Según routing.md §1–§4, la clase parte de Balanced; el coste de fallo alto la eleva un escalón a Deep, sin compensación de repetición mecánica alta. La celda Anthropic claude-sonnet-5-5 es la única EligibleCell que permite write-commit-push; su catálogo está verificado el 2026-09-30 y reporta la capacidad y efforts medium/high medidos en U-04 y en el piloto de I-61; el piloto documenta el Worker con high. Elijo su effort probado high y perfil ROUTINE_IMPLEMENTATION, el perfil de la clase de implementación de pruebas. El preflight comparó Authorities, AllowedWriteScope, ForbiddenWriteScope, Invariants, RequiredTests y StopConditions con el contrato, elemento a elemento y en orden; dio igualdad exacta en las seis colecciones, incluidas Section y Class de Authorities. Sin archivos nuevos; el RED afecta solo la prueba de distribución y el harness; el GREEN afecta solo el target, el verificador y los tres documentos enumerados. El Worker debe informar al inicio el directorio efectivo y operar con rutas absolutas según el contrato.","ModelEscalationReason":null,"RoutingEnforcement":"required","Authorities":[{"Path":"docs/initiatives/I-65-rd11-autoloader-gate.md","Section":"archivo completo","Class":"UNIT_DOC"},{"Path":"docs/automation/decisions/I-65-owner-disposition-ready-decisions-autoloader-gate.original.txt","Section":"archivo completo","Class":"UNIT_DOC"},{"Path":"docs/automation/decisions/I-65-owner-answer-codex-ceiling-rd11.original.txt","Section":"archivo completo","Class":"UNIT_DOC"},{"Path":"docs/automation/decisions/I-65.md","Section":"archivo completo","Class":"UNIT_DOC"},{"Path":"docs/initiatives/I-65-ready-preparation.md","Section":"archivo completo","Class":"UNIT_DOC"},{"Path":"docs/initiatives/I-65-proposal-v3.1.md","Section":"archivo completo (Frozen: yes)","Class":"UNIT_DOC"},{"Path":"docs/initiatives/I-65-interop-analisis-estructural.md","Section":"archivo completo","Class":"UNIT_DOC"},{"Path":"docs/adr/0050-interoperabilidad-analisis-estructural.md","Section":"archivo completo","Class":"UNIT_CHANGE"},{"Path":"docs/adr/0003-referencias-autocad-para-ci.md","Section":"archivo completo","Class":"EXTERNAL"},{"Path":"AGENTS.md","Section":"## Convenciones arquitectonicas (obligatorias)","Class":"EXTERNAL"},{"Path":"docs/INITIATIVE_LIFECYCLE.md","Section":"## 7. Gates funcionales","Class":"EXTERNAL"},{"Path":"docs/AUTOMATION_PLAN.md","Section":"## 16. Ejecución delegada bajo orden del Coordinator","Class":"EXTERNAL"},{"Path":"docs/automation/agent-execution/README.md","Section":"archivo completo","Class":"EXTERNAL"},{"Path":"docs/automation/agent-execution/routing.md","Section":"## 1. Clases de tarea y ## 4. Algoritmo","Class":"EXTERNAL"},{"Path":"docs/initiatives/PROMPT_TEMPLATES.md","Section":"## G. Delegación de ejecución","Class":"EXTERNAL"}],"Objective":"Ejecutar la tarea RD11-AUTOLOADER-TABLE conforme al contrato de gate de revisión 91f82d6d: hacer que la tabla aprobada assets/structural-analysis/ram-elements/section-material-map.json viaje byte a byte en el bundle del Autoloader en Contents/structural-analysis/ram-elements/section-material-map.json, junto a la ubicación donde RACKRAMPAQUETE ya la busca. Seguir una cadena RED -> GREEN. RED: modificar solo la prueba de distribución tests/RackCad.Tests/StructuralAnalysis/StructuralAnalysisPluginCommandGuardTests.cs, sustituyendo LaTablaNoViajaEnElPaqueteDelAutoloader_NiElDestinoDelPaqueteSeToca por pruebas positivas, y añadir los casos al harness deploy/test-verify-bundle.ps1. GREEN: modificar solo el target AssembleAutoloaderBundle de src/RackCad.Plugin/RackCad.Plugin.csproj, deploy/verify-bundle.ps1 y la documentación estrictamente necesaria en README.md, docs/guias/despliegue.md y docs/guias/interoperabilidad-ram-elements.md. No crear archivos nuevos. Operar dentro del worktree esperado con rutas absolutas y aplicar los controles del contrato.","AllowedWriteScope":["src/RackCad.Plugin/RackCad.Plugin.csproj","deploy/verify-bundle.ps1","deploy/test-verify-bundle.ps1","tests/RackCad.Tests/StructuralAnalysis/StructuralAnalysisPluginCommandGuardTests.cs","README.md","docs/guias/despliegue.md","docs/guias/interoperabilidad-ram-elements.md"],"ForbiddenWriteScope":["assets/structural-analysis/ram-elements/section-material-map.json","assets/","src/RackCad.Domain/","src/RackCad.Application/","src/RackCad.UI/","src/RackCad.Plugin/RackRamElementsCommands.cs","src/RackCad.Plugin/RackAyudaCommands.cs","src/RackCad.Plugin/Systems/","src/RackCad.Plugin/Views/","src/RackCad.Plugin/Drawing/","src/RackCad.Plugin/KindHandlers/","tests/RackCad.Tests/StructuralAnalysis/StructuralAnalysisPluginCommandGuard.cs","tests/RackCad.Tests/StructuralAnalysis/StructuralAnalysisPluginCommandProductTableTests.cs","tests/RackCad.Tests/StructuralAnalysis/StructuralAnalysisRamElementsGuardTests.cs","tests/RackCad.Tests/StructuralAnalysis/StructuralAnalysisRamElementsHardeningGuardTests.cs","tests/RackCad.Tests/StructuralAnalysis/StructuralAnalysisSourceGuardTests.cs","tests/RackCad.Tests/StructuralAnalysis/StructuralAnalysisRamElementsFixtures.cs","tests/RackCad.Tests/StructuralAnalysis/Fixtures/","tests/RackCad.Tests/RackCad.Tests.csproj","tests/RackCad.Tests/Golden/","tests/RackCad.Tests/Fixtures/","tests/RackCad.Tests/ComputedParameters/","tests/RackCad.UI.Tests/","deploy/RackCad.bundle/","deploy/build-bundle.ps1","deploy/install-bundle.ps1","deploy/test-install-bundle.ps1","docs/guias/agregar-un-sistema.md","docs/guias/catalogos-y-plantillas.md","docs/guias/generacion-cabecera-lateral.md","docs/guias/geometria-secciones-estructurales.md","docs/guias/glosario.md","docs/guias/modelo-de-datos.md","docs/guias/secciones-estructurales.md","docs/guias/validacion-manual-autocad.md","docs/guias/variables-y-formulas.md","docs/guias/vistas-ligadas-y-proyeccion.md","docs/ARCHITECTURE.md","docs/AUTOMATION_PLAN.md","docs/FOUNDATIONS.md","docs/HANDOFF.md","docs/INITIATIVE_LIFECYCLE.md","docs/ROADMAP.md","docs/WORKFLOW.md","docs/adr/","docs/architecture/","docs/archivo/","docs/auditoria-arquitectura-2026-07.md","docs/automation/","docs/context-packs/","docs/ideas-futuras.md","docs/initiatives/","tools/","eng/",".github/","RackCad.sln","Directory.Build.props","Directory.Build.targets","global.json","NuGet.Config",".gitattributes",".gitignore",".editorconfig","AGENTS.md","CLAUDE.md"],"Invariants":["RD-INV-01 (contrato del gate seccion 2): el target AssembleAutoloaderBundle de src/RackCad.Plugin/RackCad.Plugin.csproj copia la tabla desde su fuente unica assets/structural-analysis/ram-elements/section-material-map.json, byte a byte (Copy de MSBuild, sin transformarla), a Contents/structural-analysis/ram-elements/section-material-map.json dentro del bundle, la misma ruta relativa que el Link del elemento Content de la tabla (structural-analysis/ram-elements/section-material-map.json); los cuatro DLL de RackCad, catalogs/, PackageContents.xml y la regeneracion completa (RemoveDir y MakeDir) no cambian; el elemento Content de la tabla no cambia; ningun nombre nuevo del proyecto contiene StructuralAnalysis.RamTool","RD-INV-02: deploy/verify-bundle.ps1 sigue siendo una lista permitida fail-closed; admite la tabla SOLO en la ruta exacta Contents/structural-analysis/ram-elements/section-material-map.json; exige que exista; exige que su SHA-256 sea igual al de la tabla fuente aprobada (parametro nuevo -SectionMapSourcePath; por omision assets/structural-analysis/ram-elements/section-material-map.json del repositorio, igual que -CatalogsSourceDir); rechaza cualquier otro archivo bajo Contents/structural-analysis/ y la tabla en cualquier otra ruta; ninguna comprobacion existente (DLL de Autodesk, cuatro DLL, DLL iguales al publish, catalogos iguales a assets/catalogs, manifiesto, version y series) se relaja, se elimina ni cambia su mensaje","RD-INV-03: deploy/test-verify-bundle.ps1 acepta el bundle valido con la tabla y rechaza, cada uno con su motivo en la salida, al menos: tabla ausente, tabla modificada (un byte anadido), tabla en una ruta no autorizada dentro de Contents y un archivo extra junto a la tabla; los nueve casos negativos actuale